{
  "schema_version": "ctoa.p8-operational-proof.v1",
  "proof_id": "fixture-p8-ready",
  "observed_at_unix_ms": 1783799998000,
  "status": "ready",
  "source": "fixture",
  "background_status_sha256": "eec6bca94a2156b2422f212cc34fc9f805ca334b9bbd931c8db1c354a630a62d",
  "live_manifest_sha256": "f2f891b1ee96afb5bcd3fa6eef08637987cffcb1f7084d8f0e991c95b83ce416",
  "helper_version": "fixture-v1",
  "conditions_observation_sha256": "f6eba7749b628026694aa3e9b8a0213c060b9b6315a0875663ef82bd65d3ed1a",
  "contract_valid": true,
  "trusted_live_manifest_pin": true,
  "live_manifest_parity": true,
  "live_files_unchanged": true,
  "exact_active_client_process": true,
  "fresh_online_heartbeat": true,
  "helper_version_match": true,
  "capability_fail_closed": true,
  "client_process_stable": true,
  "screenshot_count_stable": true,
  "no_screen_contract": true,
  "dispatch_allowed": false,
  "runtime_actions": false,
  "executes_plan": false,
  "execute_once_allowed": false,
  "promotion_allowed": false,
  "intrusive_actions_performed": []
}
